file,utt_id,variant,ref,hyp,wer
/Users/gabrieladiaz/Documents/GitHub/p2-gabexa-proj2/pitch_form/spk014/2007-132570-0021_pitch_form.wav,2007-132570-0021,pitch_form,ALL THE WORLD COULD NOT PERSUADE ME OUT OF THEM ROBERTO AND SEBASTIAN AND HALF A DOZEN MORE OF THEM WENT INTO FITS TO BE SURE THERE WAS NO OCCASION FOR THAT I SAID MYSELF THERE WAS NO NEED OF THAT,all the world could not be swaying out of them. The legislation has not risen more than that. This is the truth. We should go to each one. That is the result of this world.,0.7804878048780488
/Users/gabrieladiaz/Documents/GitHub/p2-gabexa-proj2/pitch_form/spk014/2007-132570-0022_pitch_form.wav,2007-132570-0022,pitch_form,FOR SAYS I WHEN THE ENEMY COMES WHAT A PRETTY FIGURE THEY WILL CUT IF THEY ARE TO FALL DOWN IN FITS ALL OF A ROW THE ENEMY WON'T BE SO CIVIL PERHAPS AS TO WALK OFF LIKE THE GHOST AND LEAVE THEM TO HELP ONE ANOTHER UP,Why right now I am a andy class with a pretty beautiful thing That I know that I am going through some of the air flow And is a little bit more than those which are going to be very beautiful,0.8958333333333334
/Users/gabrieladiaz/Documents/GitHub/p2-gabexa-proj2/pitch_form/spk014/2007-132570-0024_pitch_form.wav,2007-132570-0024,pitch_form,BEING BECAUSE IT IS NO BUSINESS OF MINE TO LOOK GRUFF AND FIGHT BATTLES EMILY ENDEAVOURED TO CORRECT THE SUPERSTITIOUS WEAKNESS OF ANNETTE THOUGH SHE COULD NOT ENTIRELY SUBDUE HER OWN TO WHICH THE LATTER ONLY REPLIED,"Listen to my sisters' gosh while her child will be well known to be in a spiritual evolution is kinda amazing Wearing a Facial Life If you find them all good Gerard, and back home they's even better would believe you will grow up",1.162162162162162
/Users/gabrieladiaz/Documents/GitHub/p2-gabexa-proj2/pitch_form/spk014/2007-132570-0029_pitch_form.wav,2007-132570-0029,pitch_form,WERE THE SAME OR IF THEY WERE WHETHER THIS WAS VALANCOURT SHE HOWEVER DESIRED THAT ANNETTE WOULD ENDEAVOUR TO LEARN WHETHER ANY PRISONERS WERE IN THE CASTLE AND ALSO THEIR NAMES O DEAR MA'AMSELLE SAID ANNETTE I FORGET TO TELL YOU WHAT YOU BADE ME ASK ABOUT,"was saying, we're in a permanent assault group. She held her life in that midnight or she marked when her eight-person friend had cast on her house with her names. Oh, dear mom, Sells, and I would like to tell you what you gave me asked that.",0.8297872340425532
/Users/gabrieladiaz/Documents/GitHub/p2-gabexa-proj2/pitch_form/spk014/2007-132570-0031_pitch_form.wav,2007-132570-0031,pitch_form,BUT PRAY BE SECRET MA'AM THAT HIS EXCELLENZA INTRODUCED HER ONLY TO IMPOSE UPON THE WORLD THAT HAD BEGUN TO MAKE FREE WITH HER CHARACTER SO WHEN PEOPLE SAW MY LADY NOTICE HER THEY THOUGHT WHAT THEY HAD HEARD MUST BE SCANDAL,"Great and secret. There's everyone's history, and history are only true in those on the world. That's a great learning culture. So when people saw anything, they had heard of the sea's capital.",0.8333333333333334
/Users/gabrieladiaz/Documents/GitHub/p2-gabexa-proj2/pitch_form/spk014/2007-132570-0032_pitch_form.wav,2007-132570-0032,pitch_form,BUT I THOUGHT THEY WERE DISMAL SOUNDS SO SOON AFTER MY POOR LADY'S DEATH TOO,I got a real business house so soon I'm right where these have to.,0.8
/Users/gabrieladiaz/Documents/GitHub/p2-gabexa-proj2/pitch_form/spk014/2007-132570-0035_pitch_form.wav,2007-132570-0035,pitch_form,AND SAYING WHAT A FINE THING IT WAS FOR HIS EXCELLENZA TO CATCH UP MEN AND THEY WERE AS GOOD BOOTY AS ANY OTHER BECAUSE OF THE RANSOMS,Welcome to Instagram as all participants intentional. And there will be some amazing partnerships. Thanks.,0.9642857142857143
/Users/gabrieladiaz/Documents/GitHub/p2-gabexa-proj2/pitch_form/spk014/2007-132570-0044_pitch_form.wav,2007-132570-0044,pitch_form,FROM HER INFANCY REGARDED AN ACT OF INJUSTICE INSPIRED HER WITH A NOBLE THOUGH IMPRUDENT COURAGE SIGN THE PAPERS SAID MONTONI MORE IMPATIENTLY THAN BEFORE NEVER SIR,"From her empty Roman garden and actions justice, inspired her within notables the reciprocal Ritch Silence papers set notification going on in and forth Natch service",0.8518518518518519
/Users/gabrieladiaz/Documents/GitHub/p2-gabexa-proj2/pitch_form/spk014/2007-132570-0045_pitch_form.wav,2007-132570-0045,pitch_form,REPLIED EMILY THAT REQUEST WOULD HAVE PROVED TO ME THE INJUSTICE OF YOUR CLAIM HAD I EVEN BEEN IGNORANT OF MY RIGHT MONTONI TURNED PALE WITH ANGER WHILE HIS QUIVERING LIP AND LURKING EYE MADE HER ALMOST REPENT THE BOLDNESS OF HER SPEECH,That was what R,0.9767441860465116
/Users/gabrieladiaz/Documents/GitHub/p2-gabexa-proj2/pitch_form/spk014/2007-132570-0050_pitch_form.wav,2007-132570-0050,pitch_form,I COULD MAKE YOU TREMBLE AT THE BARE RECITAL HE WAS INTERRUPTED BY A GROAN WHICH SEEMED TO RISE FROM UNDERNEATH THE CHAMBER THEY WERE IN AND AS HE THREW A GLANCE ROUND IT IMPATIENCE AND RAGE FLASHED FROM HIS EYES,"Isaac became dry little and far away. Earth rock, rock, five beholdds in. Every night.",0.975609756097561
/Users/gabrieladiaz/Documents/GitHub/p2-gabexa-proj2/pitch_form/spk014/2007-132570-0053_pitch_form.wav,2007-132570-0053,pitch_form,I COULD TELL YOU THAT WHEN ONCE MY RESOLUTION IS TAKEN BUT I AM TALKING TO A BABY LET ME HOWEVER REPEAT THAT TERRIBLE AS ARE THE EXAMPLES I COULD RECITE THE RECITAL COULD NOT NOW BENEFIT YOU,"I'm telling you that the last night was on the show again. Oh, that night's on the evening. Letting her release. That's her role as our e-satons, I recite. The sign of cannot happen to you.",0.8947368421052632
/Users/gabrieladiaz/Documents/GitHub/p2-gabexa-proj2/pitch_form/spk014/2007-132570-0054_pitch_form.wav,2007-132570-0054,pitch_form,FOR THOUGH YOUR REPENTANCE WOULD PUT AN IMMEDIATE END TO OPPOSITION IT WOULD NOT NOW APPEASE MY INDIGNATION I WILL HAVE VENGEANCE AS WELL AS JUSTICE ANOTHER GROAN FILLED THE PAUSE WHICH MONTONI MADE,"But only your senses would put it in the ear and thought position. If without now he is my imagination, I will have vengeance as well as justice. I had it wrong because of the past from the day.",0.7647058823529411
/Users/gabrieladiaz/Documents/GitHub/p2-gabexa-proj2/pitch_form/spk015/4088-158077-0001_pitch_form.wav,4088-158077-0001,pitch_form,WE WERE FACE TO FACE WITH THE QUESTION WHICH WE HAD CONSIDERED AT THE CONVENTION THE PREVIOUS MONTH WHEN WAR WAS RUMORED AS TO WHAT POSITION WE AS AN ORGANIZATION SHOULD TAKE IN THIS SITUATION THE ATMOSPHERE OF THAT CONVENTION HAD BEEN DRAMATIC IN THE EXTREME,"We were asked the basis of the question which we had inserted in the actual image of the world's winner. As for what position we had as a organization to take in the situation, we had a sphere of the invention of the entire history.",0.6739130434782609
/Users/gabrieladiaz/Documents/GitHub/p2-gabexa-proj2/pitch_form/spk015/4088-158077-0015_pitch_form.wav,4088-158077-0015,pitch_form,WAS MOST PERPLEXING HERE WERE WE CITIZENS WITHOUT POWER AND RECOGNITION WITH THE ONLY WEAPONS TO WHICH A POWERLESS CLASS WHICH DOES NOT TAKE UP ARMS CAN RESORT WE COULD NOT AND WOULD NOT FIGHT WITH MEN'S WEAPONS,"One calls for action. Yet our V citizens will have power and education. Yet we lack the switch. Power is fast, which does not take a long time to serve. And they are not and we are not open in practice.",0.868421052631579
/Users/gabrieladiaz/Documents/GitHub/p2-gabexa-proj2/pitch_form/spk015/4088-158077-0017_pitch_form.wav,4088-158077-0017,pitch_form,BAYONETS MACHINE GUNS POISON GAS DEADLY GRENADES LIQUID FIRE BOMBS ARMORED TANKS PISTOLS BARBED WIRE ENTANGLEMENTS SUBMARINES MINES EVERY KNOWN SCIENTIFIC DEVICE WITH WHICH TO ANNIHILATE THE ENEMY,"Fans, machine guns, question guns, get the grades of the fire, alls, hurricanes, missiles, hotfire, animals, submarines, lines, and people trying to make you guys feel like you're in me.",1.0357142857142858
/Users/gabrieladiaz/Documents/GitHub/p2-gabexa-proj2/pitch_form/spk015/4088-158077-0023_pitch_form.wav,4088-158077-0023,pitch_form,IT WAS AN ADVANTAGE TO US IN THAT IT MADE OUR ATTACK MORE DRAMATIC ONE SUPPOSED TO BE IMPECCABLE WAS MORE VULNERABLE IT WAS A DISADVANTAGE TO HAVE TO OVERCOME THIS UNIVERSAL TRUST AND WORLD WIDE POPULARITY,He was in that history lesson that had been our attack for that. What's supposed to be an effort was not honorable. He was a piece of energy that he should not come to the University of Western Europe for 30.,0.8648648648648649
/Users/gabrieladiaz/Documents/GitHub/p2-gabexa-proj2/pitch_form/spk015/4088-158077-0026_pitch_form.wav,4088-158077-0026,pitch_form,WE INTENDED TO KNOW WHY IF DEMOCRACY WERE SO PRECIOUS AS TO DEMAND THE NATION'S BLOOD AND TREASURE FOR ITS ACHIEVEMENT ABROAD ITS EXECUTION AT HOME WAS SO UNDESIRABLE MEANWHILE,the Chinese and because of a failure we will also deliver the same Saka etc. but as soon as we get here we'llavilion for chopper.,0.9666666666666667
/Users/gabrieladiaz/Documents/GitHub/p2-gabexa-proj2/pitch_form/spk015/4088-158077-0032_pitch_form.wav,4088-158077-0032,pitch_form,AND INSTRUCTING THE CHAIRMAN OF THE CONVENTION TO REQUEST A COMMITTEE CONSISTING OF REPRESENTATIVES OF ALL LIBERAL GROUPS,"I will squeeze it here, and 겁 the screws in the socket, and go with the tool.",1.0
/Users/gabrieladiaz/Documents/GitHub/p2-gabexa-proj2/pitch_form/spk015/4088-158077-0041_pitch_form.wav,4088-158077-0041,pitch_form,THAT WE WERE ADVANCING TO THAT POSITION WHERE WE WERE AS GOOD POLITICAL MATERIAL TO BE CONTESTED OVER BY OPPOSING POLITICAL GROUPS AS WAS A MONUMENT TO A DEAD PRESIDENT AND IF THE DEMOCRATS COULD DEFEND SUCH AN ISSUE AS A WAR MEASURE,"And we were asking for that insistium park room room room LikeCarlson, your card Theories ד 22 queries",0.9302325581395349
/Users/gabrieladiaz/Documents/GitHub/p2-gabexa-proj2/pitch_form/spk015/4088-158077-0052_pitch_form.wav,4088-158077-0052,pitch_form,FOOD CONSERVATION OR WHAT NOT WOMEN FROM UNEX PECTED QUARTERS SENT TO THE GOVERNMENT THEIR PROTEST AGAINST THE PASSAGE OF MEASURES SO VITAL TO WOMEN WITHOUT WOMEN'S CONSENT COUPLED WITH AN APPEAL FOR THE LIBERATION OF WOMEN,boom concentration all of a lot more women one thirty quarter seven they have when they are. stan generation you're gonna hear go,1.0
/Users/gabrieladiaz/Documents/GitHub/p2-gabexa-proj2/pitch_form/spk015/4088-158077-0055_pitch_form.wav,4088-158077-0055,pitch_form,WITHIN ONE MONTH MICHIGAN NEBRASKA AND RHODE ISLAND GRANTED PRESIDENTIAL SUFFRAGE TO WOMEN THE LEADERS WERE BUSY MARSHALING THEIR FORCES BEHIND THE PRESIDENT'S WAR PROGRAM WHICH INCLUDED THE CONTROVERSIAL CONSCRIPTION AND ESPIONAGE BILLS THEN PENDING,"The Finneagational Arts and University challenge courses all Monday. We are celebrating the first Tikka huge Dance coming pre-p킨 up in Seattle. It is one of the one of the best baht did withbrandtekstuckers so much. The least we've been reviewing for Super Constructingтересings for the emergence of the guests. We can go to visit based on our own tips and click on the bell so to pay for the arrangement for developers helps to finish Christmas performance and student attending online вродеكون,",2.2285714285714286
/Users/gabrieladiaz/Documents/GitHub/p2-gabexa-proj2/pitch_form/spk015/4088-158077-0057_pitch_form.wav,4088-158077-0057,pitch_form,THEY HAD TO FACE A POSSIBLE CHARGE OF INCONSISTENCY INSINCERITY OR BAD FAITH THE FREEDOM OF IRELAND FOR EXAMPLE WAS NOT IN THE PROGRAM,"they have a false self-順ing consistency in security or academics. Northeastern Liти for example is an aye sign, in the throne.",0.7916666666666666
/Users/gabrieladiaz/Documents/GitHub/p2-gabexa-proj2/pitch_form/spk015/4088-158077-0059_pitch_form.wav,4088-158077-0059,pitch_form,THE ADMINISTRATION HAD LITTLE CHOICE IT MUST YIELD TO THIS PRESSURE FROM THE PEOPLE OR IT MUST SUPPRESS THE AGITATION WHICH WAS CAUSING SUCH INTEREST IT MUST PASS THE AMENDMENT OR REMOVE THE TROUBLESOME PICKETS IT DECIDED TO REMOVE THE PICKETS,"In this searching memory, it was built to the pressure from the people who were most surprised at the patient with the quality of such interest. It was not seen in the ornal desolson papers. It decided to remove the payments.",0.7073170731707317
/Users/gabrieladiaz/Documents/GitHub/p2-gabexa-proj2/pitch_form/spk015/4088-158077-0071_pitch_form.wav,4088-158077-0071,pitch_form,CAN BE CHANGED IN THE TWINKLING OF AN EYE THE RESPONSIBILITY FOR OUR PROTEST IS THEREFORE WITH THE ADMINISTRATION AND NOT WITH THE WOMEN OF AMERICA IF THE LACK OF DEMOCRACY AT HOME WEAKENS THE ADMINISTRATION,"and it can't be in the thinking of a lie. There is possibility for our protest against it, for there is the administration and not with the American in the lack of the law of the state administration.",0.6944444444444444
/Users/gabrieladiaz/Documents/GitHub/p2-gabexa-proj2/pitch_form/spk015/4088-158077-0072_pitch_form.wav,4088-158077-0072,pitch_form,IN ITS FIGHT FOR DEMOCRACY THREE THOUSAND MILES AWAY THIS WAS TOO DREADFUL A FLURRY AT THE GATES OF THE CHIEF OF THE NATION AT SUCH A TIME WOULD NEVER DO OUR ALLIES IN THE CRUSADE FOR DEMOCRACY MUST NOT KNOW THAT WE HAD A DAY BY DAY UNREST AT HOME,It's like 40 walks in 3000 miles away. This is too grateful. A clear and a ace of the chief of the nation has such pride in her view. Our elders in the newspaper are watching us not know that we had a day by day on Resta call.,0.5490196078431373
/Users/gabrieladiaz/Documents/GitHub/p2-gabexa-proj2/pitch_form/spk015/4088-158077-0075_pitch_form.wav,4088-158077-0075,pitch_form,THE CHIEF OF POLICE MAJOR PULLMAN WAS DETAILED TO REQUEST US TO STOP PICKETING AND TO TELL US THAT IF WE CONTINUED TO PICKET WE WOULD BE ARRESTED WE HAVE PICKETED FOR SIX MONTHS WITHOUT INTERFERENCE SAID MISS PAUL HAS THE LAW BEEN CHANGED,"The children will be snagged, or will be called to be called to be called to stop the pain. And it tells us that everything can be humbling and humbling. You rest it. We have taken for six months without interference and all has lost.",0.7727272727272727
/Users/gabrieladiaz/Documents/GitHub/p2-gabexa-proj2/pitch_form/spk015/4088-158077-0077_pitch_form.wav,4088-158077-0077,pitch_form,THE FOLLOWING DAY MISS LUCY BURNS AND MISS KATHERINE MOREY OF BOSTON CARRIED TO THE WHITE HOUSE GATES WE SHALL FIGHT FOR THE THINGS WE HAVE ALWAYS HELD NEAREST OUR HEARTS FOR DEMOCRACY FOR THE RIGHT OF THOSE WHO SUBMIT TO AUTHORITY,Only k fluff hitting winners are,1.0
/Users/gabrieladiaz/Documents/GitHub/p2-gabexa-proj2/pitch_form/spk015/4088-158077-0083_pitch_form.wav,4088-158077-0083,pitch_form,AND NEVER BROUGHT TO TRIAL THE FOLLOWING DAY JUNE TWENTY THIRD MORE ARRESTS WERE MADE TWO WOMEN AT THE WHITE HOUSE TWO AT THE CAPITOL ALL CARRIED BANNERS WITH THE SAME WORDS OF THE PRESIDENT THERE WAS NO HESITATION THIS TIME THEY WERE PROMPTLY ARRESTED FOR OBSTRUCTING THE TRAFFIC,"and ever after trial, the following agent from third forestry, to another warehouse to the capital, all carry fans to the same words of the desert. There's no hesitation in sight. They were on the rest of the forestry.",0.673469387755102
/Users/gabrieladiaz/Documents/GitHub/p2-gabexa-proj2/pitch_form/spk015/4088-158077-0084_pitch_form.wav,4088-158077-0084,pitch_form,THEY TOO WERE DISMISSED AND THEIR CASES NEVER TRIED,They do work as this and their cases they're fine.,0.6666666666666666
/Users/gabrieladiaz/Documents/GitHub/p2-gabexa-proj2/pitch_form/spk015/4088-158077-0085_pitch_form.wav,4088-158077-0085,pitch_form,WHEN HOWEVER WOMEN CONTINUED TO PICKET IN THE FACE OF ARREST THE ADMINISTRATION QUICKENED ITS ADVANCE INTO THE VENTURE OF SUPPRESSION IT DECIDED TO BRING THE OFFENDERS TO TRIAL ON JUNE TWENTY SIXTH,"One power when you continue to pay in the face of a rest, the administration fee is passed into the interest of the Russian. It's added to bring the members to file on June 26th.",0.6060606060606061
/Users/gabrieladiaz/Documents/GitHub/p2-gabexa-proj2/pitch_form/spk015/4088-158077-0086_pitch_form.wav,4088-158077-0086,pitch_form,TO PAY A FINE WOULD BE AN ADMISSION OF GUILT WE ARE INNOCENT THE SIX WOMEN WHO WERE PRIVILEGED TO SERVE THE FIRST TERMS OF IMPRISONMENT FOR SUFFRAGE IN THIS COUNTRY WERE MISS KATHERINE MOREY OF MASSACHUSETTS MISSUS ANNIE ARNEIL,"And fine, we can mention a field we are in six. The six women who are in the first turn of the movement, suffering in this country, who is after board of Massachusetts. Mrs. Annie Arneel.",0.7
/Users/gabrieladiaz/Documents/GitHub/p2-gabexa-proj2/pitch_form/spk015/4088-158077-0090_pitch_form.wav,4088-158077-0090,pitch_form,CHAMP CLARK AND HIS THRONG WERE NOT MOLESTED THE WOMEN WITH PRACTICALLY A DESERTED STREET WERE ARRESTED AND SERVED JAIL TERMS FOR OBSTRUCTING TRAFFIC THE TRIAL OF THIS GROUP WAS DELAYED TO GIVE THE JAIL AUTHORITIES TIME TO VACATE AND TIDY UP,"such that it's a basic health care efforts... on B living, if we get a job, if that's what one of these issues would be for. It's a realm in which we belong to an important unfulfilledbatics sense unjustness of happiness-�tonis is in the form of examination of function for us to be part of this- received such pathpoint. In this time of history being providing self-fulfilled life, for several times everyards. I want to censor myself, faithfulness to Earth members. passing with these Ranchers that an appropriate or can no longer be on the ground.",2.142857142857143
/Users/gabrieladiaz/Documents/GitHub/p2-gabexa-proj2/pitch_form/spk016/6019-3185-0003_pitch_form.wav,6019-3185-0003,pitch_form,AS IN FACT ALREADY AND MORE THAN ONCE IN CONNECTION WITH THESE VERY EVENTS THIS LESSON HAS OBTAINED THE EFFECTUAL ATTENTION OF CHRISTIAN KINGS AND PRINCES ASSEMBLED IN CONGRESS,"As in back already, and more than once, in connection with these variables, this lesson was obtained the actual attention of Christian games and criticism on Hunters.",0.41379310344827586
/Users/gabrieladiaz/Documents/GitHub/p2-gabexa-proj2/pitch_form/spk016/6019-3185-0012_pitch_form.wav,6019-3185-0012,pitch_form,DOORS OPEN THAT SHOULD BE SHUT OR UNLOCKED THAT SHOULD BE TRIPLY SECURED THE VERY WALLS GONE BARRIERS SWALLOWED UP BY UNKNOWN ABYSSES NOTHING AROUND ONE BUT FRAIL CURTAINS AND A WORLD OF ILLIMITABLE NIGHT,"towards openness should be shut or unlocked. It should be true. It is a period. The very walls, the all-in. Periods, all that I unloaded in business. It should not be around where a frail curtain is to the world of the till and nipple night.",1.0
/Users/gabrieladiaz/Documents/GitHub/p2-gabexa-proj2/pitch_form/spk016/6019-3185-0016_pitch_form.wav,6019-3185-0016,pitch_form,WITH RESPECT TO ALL THE MOVEMENTS OF THE CASE I MAY ADD THAT I HAD ANOTHER ADVANTAGE NOT POSSESSED OR NOT IN THE SAME DEGREE BY ANY OTHER INHABITANT OF THE TOWN I WAS PERSONALLY ACQUAINTED WITH EVERY FAMILY OF THE SLIGHTEST ACCOUNT BELONGING TO THE RESIDENT POPULATION,"I didn't respect you all the other lives of this. I look at it and I have another image, nothing is asked for nothing's said to be great by the other. I have a thing that was out. I was personally afraid of everything, the size it had was the right to offer.",0.875
/Users/gabrieladiaz/Documents/GitHub/p2-gabexa-proj2/pitch_form/spk016/6019-3185-0021_pitch_form.wav,6019-3185-0021,pitch_form,MISTER WYNDHAM'S SUCCESSION TO THE VAST FAMILY ESTATES IS INEVITABLE AND PROBABLY NEAR AT HAND MEANTIME HE IS ANXIOUS FOR SOME ASSISTANCE IN HIS STUDIES INTELLECTUALLY,"This is a reference, it says you, the vast family of states, do they have it? And follow their hand. Because we have inches for the systems in these times. In the natural way.",1.1153846153846154
/Users/gabrieladiaz/Documents/GitHub/p2-gabexa-proj2/pitch_form/spk016/6019-3185-0027_pitch_form.wav,6019-3185-0027,pitch_form,IT WILL BE EASILY IMAGINED THAT SUCH A STORY ALREADY ROMANTIC ENOUGH IN ITS FIRST OUTLINE WOULD LOSE NOTHING IN THE TELLING AN ENGLISHMAN TO BEGIN WITH WHICH NAME OF ITSELF AND AT ALL TIMES IS A PASSPORT INTO GERMAN FAVOR,"It will do easily imagine that such a story all right. You know, right here and not been in this first house on. We're doing nothing in the telling. I didn't wish we would be able to wish name it itself. And all the time to the past 40 to your own favor.",0.9512195121951219
/Users/gabrieladiaz/Documents/GitHub/p2-gabexa-proj2/pitch_form/spk016/6019-3185-0041_pitch_form.wav,6019-3185-0041,pitch_form,HAD COMMUNICATED TO HIS MANNERS A MORE THAN MILITARY FRANKNESS BUT THE PROFOUND MELANCHOLY WHICH POSSESSED HIM FROM WHATEVER CAUSE IT AROSE NECESSARILY CHILLED THE NATIVE FREEDOM OF HIS DEMEANOR,"and you can get to these matters on more than those very rightists. But for family, nothing got me interested from whatever cause of the world. Then certainly it's true that they feel what we do here.",1.0
/Users/gabrieladiaz/Documents/GitHub/p2-gabexa-proj2/pitch_form/spk016/6019-3185-0042_pitch_form.wav,6019-3185-0042,pitch_form,UNLESS WHEN IT WAS REVIVED BY STRENGTH OF FRIENDSHIP OR OF LOVE THE EFFECT WAS AWKWARD AND EMBARRASSING TO ALL PARTIES EVERY VOICE PAUSED OR FALTERED WHEN HE ENTERED A ROOM DEAD SILENCE ENSUED,"And last week, under five high strength of friendship over and over. The event goes off and there is in small parties. Everybody's palms are falter in the inner room, get silent since you're...",0.8529411764705882
/Users/gabrieladiaz/Documents/GitHub/p2-gabexa-proj2/pitch_form/spk016/6019-3185-0046_pitch_form.wav,6019-3185-0046,pitch_form,NEVER WAS THERE SO VICTORIOUS A CONQUEST INTERCHANGED BETWEEN TWO YOUTHFUL HEARTS NEVER BEFORE SUCH A RAPTURE OF INSTANTANEOUS SYMPATHY I DID NOT WITNESS THE FIRST MEETING OF THIS MYSTERIOUS MAXIMILIAN AND THIS MAGNIFICENT MARGARET,"Never because it's over, it's on West interchanged between two new courts. The third four is a rapture of insiting, is simiting. And not witness the first meeting with this mysterious maximum unit, and this magnificent Margaret.",0.5714285714285714
/Users/gabrieladiaz/Documents/GitHub/p2-gabexa-proj2/pitch_form/spk016/6019-3185-0048_pitch_form.wav,6019-3185-0048,pitch_form,ON THE PART OF MARGARET IT SEEMED AS IF A NEW WORLD HAD DAWNED UPON HER THAT SHE HAD NOT SO MUCH AS SUSPECTED AMONG THE CAPACITIES OF HUMAN EXPERIENCE LIKE SOME BIRD SHE SEEMED WITH POWERS UNEXERCISED FOR SOARING AND FLYING,All the part of Margaret is seen as a new role in the development of honor that she and also lunch and suspected of under her passives of human experience. Like some birds she's seen with powers on exercise for sword and flying.,0.6428571428571429
/Users/gabrieladiaz/Documents/GitHub/p2-gabexa-proj2/pitch_form/spk016/6019-3185-0054_pitch_form.wav,6019-3185-0054,pitch_form,NOT DAZZLING BUT RESPECTABLE AND SO AMIABLE WERE HIS TEMPER AND MANNERS THAT I HAD INTRODUCED HIM EVERYWHERE AND EVERYWHERE HE WAS A FAVORITE AND EVERYWHERE INDEED EXCEPT EXACTLY THERE WHERE ONLY IN THIS WORLD HE CARED FOR FAVOR,"not as old as you love recyclable. And so, I think you always take right fingers that I didn't think you'd take every turn. And everywhere he was away. And everywhere he is, except he's actually there who are only in this world, he's carried for favor.",0.8205128205128205
/Users/gabrieladiaz/Documents/GitHub/p2-gabexa-proj2/pitch_form/spk016/6019-3185-0055_pitch_form.wav,6019-3185-0055,pitch_form,SHE IT WAS WHOM HE LOVED AND HAD LOVED FOR YEARS WITH THE WHOLE ARDOR OF HIS ARDENT SOUL SHE IT WAS FOR WHOM OR AT WHOSE COMMAND HE WOULD WILLINGLY HAVE DIED EARLY HE HAD FELT THAT IN HER HANDS LAY HIS DESTINY,"She was in Lima and had more three years, a whole honor of the art itself. She was a guru or a peace friend. He knew the rule had died. Early, he gave out that human hands laid his destiny.",0.7045454545454546
/Users/gabrieladiaz/Documents/GitHub/p2-gabexa-proj2/pitch_form/spk016/6019-3185-0060_pitch_form.wav,6019-3185-0060,pitch_form,REVEREND FATHER DO NOT YOU WITH THE PURPOSE OF REMOVING ME FROM TEMPTATION BE YOURSELF THE INSTRUMENT FOR TEMPTING ME INTO A REBELLION AGAINST THE CHURCH DO NOT YOU WEAVE SNARES ABOUT MY STEPS SNARES THERE ARE ALREADY AND BUT TOO MANY,"Her report do not you, with a purpose of renewing the presentation, dig yourself the answer to pretend to be into a rebellion against the church. Do not you eat stairs not as heavy as they are already, and much you may.",0.6190476190476191
/Users/gabrieladiaz/Documents/GitHub/p2-gabexa-proj2/pitch_form/spk016/6019-3185-0078_pitch_form.wav,6019-3185-0078,pitch_form,NOW RUSHED TUMULTUOUSLY OUT OF THE BALLROOM TO SATISFY THEMSELVES ON THE SPOT THE DISTANCE WAS NOT GREAT AND WITHIN FIVE MINUTES SEVERAL PERSONS RETURNED HASTILY AND CRIED OUT TO THE CROWD OF LADIES THAT ALL WAS TRUE WHICH THE YOUNG GIRL HAD SAID,"That was too much to see out of the old room to satisfy the Zelda on the side. It isn't with that right, and then in five minutes several persons returning to the game, and cry out to the crowd of things, and all the truth in the underworld is dead.",0.7272727272727273
/Users/gabrieladiaz/Documents/GitHub/p2-gabexa-proj2/pitch_form/spk016/6019-3185-0083_pitch_form.wav,6019-3185-0083,pitch_form,THAT SIGHT WAS MORE THAN COULD BE BORNE BY ONE WHO STOOD A LITTLE BEHIND THE GROUP HE RUSHED FORWARD WITH EYES GLARING LIKE A TIGER'S AND LEVELED A BLOW AT MAXIMILIAN IT WAS POOR MANIACAL VON HARRELSTEIN,"That site was more than before and I wanted to show you a little behind the group. You are forward with eyes wearing my tigers and love the flow of acting in the sport and I, or long hair, will stay.",0.7894736842105263
/Users/gabrieladiaz/Documents/GitHub/p2-gabexa-proj2/pitch_form/spk016/6019-3185-0089_pitch_form.wav,6019-3185-0089,pitch_form,GOLD REPEATERS MASSY PLATE GOLD SNUFF BOXES UNTOUCHED THAT ARGUMENT CERTAINLY WEIGHED MUCH IN HIS FAVOR AND YET AGAIN IT WAS TURNED AGAINST HIM FOR A MAGISTRATE ASKED HIM HOW HE HAPPENED TO KNOW ALREADY THAT NOTHING HAD BEEN TOUCHED,"Go repeaters, massively, goals, successes, on-tests that argument certainly weighed much in sooner. And yet again, you can turn it into a good set. For a much straight, as soon as he happens to have already, then nothing has been touched.",0.725
