file,utt_id,variant,ref,hyp,wer
/Users/gabrieladiaz/Documents/GitHub/p2-gabexa-proj2/pitch_form_noise/spk014/2007-132570-0054_pitch_form_noise.wav,2007-132570-0054,pitch_form_noise,FOR THOUGH YOUR REPENTANCE WOULD PUT AN IMMEDIATE END TO OPPOSITION IT WOULD NOT NOW APPEASE MY INDIGNATION I WILL HAVE VENGEANCE AS WELL AS JUSTICE ANOTHER GROAN FILLED THE PAUSE WHICH MONTONI MADE,"But when you're in the end of the mission, you will not have to be in the future. I will have to be in the future. And that is your new life.",0.9117647058823529
/Users/gabrieladiaz/Documents/GitHub/p2-gabexa-proj2/pitch_form_noise/spk015/4088-158077-0001_pitch_form_noise.wav,4088-158077-0001,pitch_form_noise,WE WERE FACE TO FACE WITH THE QUESTION WHICH WE HAD CONSIDERED AT THE CONVENTION THE PREVIOUS MONTH WHEN WAR WAS RUMORED AS TO WHAT POSITION WE AS AN ORGANIZATION SHOULD TAKE IN THIS SITUATION THE ATMOSPHERE OF THAT CONVENTION HAD BEEN DRAMATIC IN THE EXTREME,"Two of these is the creation, but Elephant vs. Inter-ed special MB command is now on World And alltså Electronics and.)",0.9782608695652174
/Users/gabrieladiaz/Documents/GitHub/p2-gabexa-proj2/pitch_form_noise/spk015/4088-158077-0015_pitch_form_noise.wav,4088-158077-0015,pitch_form_noise,WAS MOST PERPLEXING HERE WERE WE CITIZENS WITHOUT POWER AND RECOGNITION WITH THE ONLY WEAPONS TO WHICH A POWERLESS CLASS WHICH DOES NOT TAKE UP ARMS CAN RESORT WE COULD NOT AND WOULD NOT FIGHT WITH MEN'S WEAPONS,"You're right! Your breathing, zeasend, and that power of wisdom begins. When you are in your as soon as you start your searching with your thoughts and so. You're not and you're not even.",0.8947368421052632
/Users/gabrieladiaz/Documents/GitHub/p2-gabexa-proj2/pitch_form_noise/spk015/4088-158077-0017_pitch_form_noise.wav,4088-158077-0017,pitch_form_noise,BAYONETS MACHINE GUNS POISON GAS DEADLY GRENADES LIQUID FIRE BOMBS ARMORED TANKS PISTOLS BARBED WIRE ENTANGLEMENTS SUBMARINES MINES EVERY KNOWN SCIENTIFIC DEVICE WITH WHICH TO ANNIHILATE THE ENEMY,for raising her Yasular raising her in front of me for object워ning for making Spin for garantizing my personal self Japan audio,1.0
/Users/gabrieladiaz/Documents/GitHub/p2-gabexa-proj2/pitch_form_noise/spk015/4088-158077-0023_pitch_form_noise.wav,4088-158077-0023,pitch_form_noise,IT WAS AN ADVANTAGE TO US IN THAT IT MADE OUR ATTACK MORE DRAMATIC ONE SUPPOSED TO BE IMPECCABLE WAS MORE VULNERABLE IT WAS A DISADVANTAGE TO HAVE TO OVERCOME THIS UNIVERSAL TRUST AND WORLD WIDE POPULARITY,"If it was in that, you would have to let it down, to have more than that. But suppose to get an effort to overcome it, you would have to do it, and you would have to get a lot of stress in the world.",1.0
/Users/gabrieladiaz/Documents/GitHub/p2-gabexa-proj2/pitch_form_noise/spk015/4088-158077-0026_pitch_form_noise.wav,4088-158077-0026,pitch_form_noise,WE INTENDED TO KNOW WHY IF DEMOCRACY WERE SO PRECIOUS AS TO DEMAND THE NATION'S BLOOD AND TREASURE FOR ITS ACHIEVEMENT ABROAD ITS EXECUTION AT HOME WAS SO UNDESIRABLE MEANWHILE,these those who wereś,1.0
/Users/gabrieladiaz/Documents/GitHub/p2-gabexa-proj2/pitch_form_noise/spk015/4088-158077-0032_pitch_form_noise.wav,4088-158077-0032,pitch_form_noise,AND INSTRUCTING THE CHAIRMAN OF THE CONVENTION TO REQUEST A COMMITTEE CONSISTING OF REPRESENTATIVES OF ALL LIBERAL GROUPS,I had eaten doctors and children in fui geeks when theinsis never affected. After all this.,0.9444444444444444
/Users/gabrieladiaz/Documents/GitHub/p2-gabexa-proj2/pitch_form_noise/spk015/4088-158077-0041_pitch_form_noise.wav,4088-158077-0041,pitch_form_noise,THAT WE WERE ADVANCING TO THAT POSITION WHERE WE WERE AS GOOD POLITICAL MATERIAL TO BE CONTESTED OVER BY OPPOSING POLITICAL GROUPS AS WAS A MONUMENT TO A DEAD PRESIDENT AND IF THE DEMOCRATS COULD DEFEND SUCH AN ISSUE AS A WAR MEASURE,"that we heard asking vaccination for the virus whereas protocol catfish was linked that number ought to only mothers and children once when they were. Ah, it was impacted and took as usual many years.",0.9069767441860465
/Users/gabrieladiaz/Documents/GitHub/p2-gabexa-proj2/pitch_form_noise/spk015/4088-158077-0052_pitch_form_noise.wav,4088-158077-0052,pitch_form_noise,FOOD CONSERVATION OR WHAT NOT WOMEN FROM UNEX PECTED QUARTERS SENT TO THE GOVERNMENT THEIR PROTEST AGAINST THE PASSAGE OF MEASURES SO VITAL TO WOMEN WITHOUT WOMEN'S CONSENT COUPLED WITH AN APPEAL FOR THE LIBERATION OF WOMEN,"Really automatically, almost a few Audemars. But it takes a 4 sec Muhෑ Island if they're all desegigated in total, it makes their attic opened for women and Heralthanna all the rates have opened.",0.972972972972973
/Users/gabrieladiaz/Documents/GitHub/p2-gabexa-proj2/pitch_form_noise/spk015/4088-158077-0055_pitch_form_noise.wav,4088-158077-0055,pitch_form_noise,WITHIN ONE MONTH MICHIGAN NEBRASKA AND RHODE ISLAND GRANTED PRESIDENTIAL SUFFRAGE TO WOMEN THE LEADERS WERE BUSY MARSHALING THEIR FORCES BEHIND THE PRESIDENT'S WAR PROGRAM WHICH INCLUDED THE CONTROVERSIAL CONSCRIPTION AND ESPIONAGE BILLS THEN PENDING,"Since interactions and relationships get further and further, they reside in a space where they emerge from. Who Physical in involved with the social system and emotional outlook and their learning.",0.9428571428571428
/Users/gabrieladiaz/Documents/GitHub/p2-gabexa-proj2/pitch_form_noise/spk015/4088-158077-0057_pitch_form_noise.wav,4088-158077-0057,pitch_form_noise,THEY HAD TO FACE A POSSIBLE CHARGE OF INCONSISTENCY INSINCERITY OR BAD FAITH THE FREEDOM OF IRELAND FOR EXAMPLE WAS NOT IN THE PROGRAM,they have an ex-pursal part of the Assistant figure and actually a strategy or a attack in order so for example is not important.,0.9166666666666666
/Users/gabrieladiaz/Documents/GitHub/p2-gabexa-proj2/pitch_form_noise/spk015/4088-158077-0059_pitch_form_noise.wav,4088-158077-0059,pitch_form_noise,THE ADMINISTRATION HAD LITTLE CHOICE IT MUST YIELD TO THIS PRESSURE FROM THE PEOPLE OR IT MUST SUPPRESS THE AGITATION WHICH WAS CAUSING SUCH INTEREST IT MUST PASS THE AMENDMENT OR REMOVE THE TROUBLESOME PICKETS IT DECIDED TO REMOVE THE PICKETS,"Its a never von, its an mistakes you each have received. It's being trusted or sesame seeds, it's a difficult trial, anymore. But a lamenting event, on it was to hold a long life.",0.9512195121951219
/Users/gabrieladiaz/Documents/GitHub/p2-gabexa-proj2/pitch_form_noise/spk015/4088-158077-0071_pitch_form_noise.wav,4088-158077-0071,pitch_form_noise,CAN BE CHANGED IN THE TWINKLING OF AN EYE THE RESPONSIBILITY FOR OUR PROTEST IS THEREFORE WITH THE ADMINISTRATION AND NOT WITH THE WOMEN OF AMERICA IF THE LACK OF DEMOCRACY AT HOME WEAKENS THE ADMINISTRATION,"and exchange in thinking around. There is Definitely or artόfriters to explore, is they also use the administration in the open planet, America. They also adapt democracy home administration.",0.8333333333333334
/Users/gabrieladiaz/Documents/GitHub/p2-gabexa-proj2/pitch_form_noise/spk015/4088-158077-0072_pitch_form_noise.wav,4088-158077-0072,pitch_form_noise,IN ITS FIGHT FOR DEMOCRACY THREE THOUSAND MILES AWAY THIS WAS TOO DREADFUL A FLURRY AT THE GATES OF THE CHIEF OF THE NATION AT SUCH A TIME WOULD NEVER DO OUR ALLIES IN THE CRUSADE FOR DEMOCRACY MUST NOT KNOW THAT WE HAD A DAY BY DAY UNREST AT HOME,It's like order locked each week off now to-う-う-season vera-to- porte They've learnt a thing that should undoubtedly decide their rights Our allies in touch with the locked rooms are not opened only for days Unnecessary calls,0.9215686274509803
/Users/gabrieladiaz/Documents/GitHub/p2-gabexa-proj2/pitch_form_noise/spk015/4088-158077-0075_pitch_form_noise.wav,4088-158077-0075,pitch_form_noise,THE CHIEF OF POLICE MAJOR PULLMAN WAS DETAILED TO REQUEST US TO STOP PICKETING AND TO TELL US THAT IF WE CONTINUED TO PICKET WE WOULD BE ARRESTED WE HAVE PICKETED FOR SIX MONTHS WITHOUT INTERFERENCE SAID MISS PAUL HAS THE LAW BEEN CHANGED,"The children's place may fall and will be out in class to stop the baby. And if you tell us everything, you think it will be good. We have taken for six months without even going to get involved, that's a lot of change.",0.7727272727272727
/Users/gabrieladiaz/Documents/GitHub/p2-gabexa-proj2/pitch_form_noise/spk015/4088-158077-0077_pitch_form_noise.wav,4088-158077-0077,pitch_form_noise,THE FOLLOWING DAY MISS LUCY BURNS AND MISS KATHERINE MOREY OF BOSTON CARRIED TO THE WHITE HOUSE GATES WE SHALL FIGHT FOR THE THINGS WE HAVE ALWAYS HELD NEAREST OUR HEARTS FOR DEMOCRACY FOR THE RIGHT OF THOSE WHO SUBMIT TO AUTHORITY,"The following pain with什麼 seafar,, and mustardREAMS Fearing to goide mouse pagz and cell why,cerring in the house of their 14th Mary",0.8571428571428571
/Users/gabrieladiaz/Documents/GitHub/p2-gabexa-proj2/pitch_form_noise/spk015/4088-158077-0083_pitch_form_noise.wav,4088-158077-0083,pitch_form_noise,AND NEVER BROUGHT TO TRIAL THE FOLLOWING DAY JUNE TWENTY THIRD MORE ARRESTS WERE MADE TWO WOMEN AT THE WHITE HOUSE TWO AT THE CAPITOL ALL CARRIED BANNERS WITH THE SAME WORDS OF THE PRESIDENT THERE WAS NO HESITATION THIS TIME THEY WERE PROMPTLY ARRESTED FOR OBSTRUCTING THE TRAFFIC,in red sliced bread. which caused 2 operations but,1.0
/Users/gabrieladiaz/Documents/GitHub/p2-gabexa-proj2/pitch_form_noise/spk015/4088-158077-0084_pitch_form_noise.wav,4088-158077-0084,pitch_form_noise,THEY TOO WERE DISMISSED AND THEIR CASES NEVER TRIED,We are doing all this in this and we are facing it for five.,1.4444444444444444
/Users/gabrieladiaz/Documents/GitHub/p2-gabexa-proj2/pitch_form_noise/spk015/4088-158077-0085_pitch_form_noise.wav,4088-158077-0085,pitch_form_noise,WHEN HOWEVER WOMEN CONTINUED TO PICKET IN THE FACE OF ARREST THE ADMINISTRATION QUICKENED ITS ADVANCE INTO THE VENTURE OF SUPPRESSION IT DECIDED TO BRING THE OFFENDERS TO TRIAL ON JUNE TWENTY SIXTH,"That was when Palor Irwin continued to indicated thanks to Armas. The administration, survey and incidence, and the intervention route statement. Theignant-pre iterateşekküries, and the labor slip on testing stuff",0.8484848484848485
/Users/gabrieladiaz/Documents/GitHub/p2-gabexa-proj2/pitch_form_noise/spk015/4088-158077-0086_pitch_form_noise.wav,4088-158077-0086,pitch_form_noise,TO PAY A FINE WOULD BE AN ADMISSION OF GUILT WE ARE INNOCENT THE SIX WOMEN WHO WERE PRIVILEGED TO SERVE THE FIRST TERMS OF IMPRISONMENT FOR SUFFRAGE IN THIS COUNTRY WERE MISS KATHERINE MOREY OF MASSACHUSETTS MISSUS ANNIE ARNEIL,they applied in the mission of guilt leading our innocent. The cease wit and murder misdeherfs on verse 30 onze conservativeernish representing the community requires foreign To addicted我们 to torture. But there is an al intelligence,0.925
/Users/gabrieladiaz/Documents/GitHub/p2-gabexa-proj2/pitch_form_noise/spk015/4088-158077-0090_pitch_form_noise.wav,4088-158077-0090,pitch_form_noise,CHAMP CLARK AND HIS THRONG WERE NOT MOLESTED THE WOMEN WITH PRACTICALLY A DESERTED STREET WERE ARRESTED AND SERVED JAIL TERMS FOR OBSTRUCTING TRAFFIC THE TRIAL OF THIS GROUP WAS DELAYED TO GIVE THE JAIL AUTHORITIES TIME TO VACATE AND TIDY UP,"Angard, an dangerous room with relief and gaps inside of the field or the sleepers' vest website. The next day, the new discovery is delivered for a Watsonuman and a legend.",0.9047619047619048
/Users/gabrieladiaz/Documents/GitHub/p2-gabexa-proj2/pitch_form_noise/spk016/6019-3185-0003_pitch_form_noise.wav,6019-3185-0003,pitch_form_noise,AS IN FACT ALREADY AND MORE THAN ONCE IN CONNECTION WITH THESE VERY EVENTS THIS LESSON HAS OBTAINED THE EFFECTUAL ATTENTION OF CHRISTIAN KINGS AND PRINCES ASSEMBLED IN CONGRESS,,1.0
/Users/gabrieladiaz/Documents/GitHub/p2-gabexa-proj2/pitch_form_noise/spk016/6019-3185-0012_pitch_form_noise.wav,6019-3185-0012,pitch_form_noise,DOORS OPEN THAT SHOULD BE SHUT OR UNLOCKED THAT SHOULD BE TRIPLY SECURED THE VERY WALLS GONE BARRIERS SWALLOWED UP BY UNKNOWN ABYSSES NOTHING AROUND ONE BUT FRAIL CURTAINS AND A WORLD OF ILLIMITABLE NIGHT,everyday life yeah hey,1.0
/Users/gabrieladiaz/Documents/GitHub/p2-gabexa-proj2/pitch_form_noise/spk016/6019-3185-0016_pitch_form_noise.wav,6019-3185-0016,pitch_form_noise,WITH RESPECT TO ALL THE MOVEMENTS OF THE CASE I MAY ADD THAT I HAD ANOTHER ADVANTAGE NOT POSSESSED OR NOT IN THE SAME DEGREE BY ANY OTHER INHABITANT OF THE TOWN I WAS PERSONALLY ACQUAINTED WITH EVERY FAMILY OF THE SLIGHTEST ACCOUNT BELONGING TO THE RESIDENT POPULATION,,1.0
/Users/gabrieladiaz/Documents/GitHub/p2-gabexa-proj2/pitch_form_noise/spk016/6019-3185-0021_pitch_form_noise.wav,6019-3185-0021,pitch_form_noise,MISTER WYNDHAM'S SUCCESSION TO THE VAST FAMILY ESTATES IS INEVITABLE AND PROBABLY NEAR AT HAND MEANTIME HE IS ANXIOUS FOR SOME ASSISTANCE IN HIS STUDIES INTELLECTUALLY,Then they reply on Instagram it's a review in other languages. They reply on Twitter with stumbled from supporters and Twitter with sentiment gente. And also the other languages.,1.1153846153846154
/Users/gabrieladiaz/Documents/GitHub/p2-gabexa-proj2/pitch_form_noise/spk016/6019-3185-0027_pitch_form_noise.wav,6019-3185-0027,pitch_form_noise,IT WILL BE EASILY IMAGINED THAT SUCH A STORY ALREADY ROMANTIC ENOUGH IN ITS FIRST OUTLINE WOULD LOSE NOTHING IN THE TELLING AN ENGLISHMAN TO BEGIN WITH WHICH NAME OF ITSELF AND AT ALL TIMES IS A PASSPORT INTO GERMAN FAVOR,"They don't even get in there. That's why it's going all right. I'm already in the office for a count one. We're being done here with that. I didn't even get in there. We're being done here with that. And then all the time, we're at the floor with the dirty bed.",1.1951219512195121
/Users/gabrieladiaz/Documents/GitHub/p2-gabexa-proj2/pitch_form_noise/spk016/6019-3185-0041_pitch_form_noise.wav,6019-3185-0041,pitch_form_noise,HAD COMMUNICATED TO HIS MANNERS A MORE THAN MILITARY FRANKNESS BUT THE PROFOUND MELANCHOLY WHICH POSSESSED HIM FROM WHATEVER CAUSE IT AROSE NECESSARILY CHILLED THE NATIVE FREEDOM OF HIS DEMEANOR,and get paid through there. I am warning you everything. You can travel now and tell what you could do. Whatever I am doing and I and I it will be much easier than remembering.,1.1333333333333333
/Users/gabrieladiaz/Documents/GitHub/p2-gabexa-proj2/pitch_form_noise/spk016/6019-3185-0042_pitch_form_noise.wav,6019-3185-0042,pitch_form_noise,UNLESS WHEN IT WAS REVIVED BY STRENGTH OF FRIENDSHIP OR OF LOVE THE EFFECT WAS AWKWARD AND EMBARRASSING TO ALL PARTIES EVERY VOICE PAUSED OR FALTERED WHEN HE ENTERED A ROOM DEAD SILENCE ENSUED,Guess it's a demon stone stone stoneauen,0.9705882352941176
/Users/gabrieladiaz/Documents/GitHub/p2-gabexa-proj2/pitch_form_noise/spk016/6019-3185-0046_pitch_form_noise.wav,6019-3185-0046,pitch_form_noise,NEVER WAS THERE SO VICTORIOUS A CONQUEST INTERCHANGED BETWEEN TWO YOUTHFUL HEARTS NEVER BEFORE SUCH A RAPTURE OF INSTANTANEOUS SYMPATHY I DID NOT WITNESS THE FIRST MEETING OF THIS MYSTERIOUS MAXIMILIAN AND THIS MAGNIFICENT MARGARET,never but the real get to date supernatural series is being didn't bring upon very poor rabbits the crane still astringent and for a community And I didn't know it was heard.,0.9714285714285714
/Users/gabrieladiaz/Documents/GitHub/p2-gabexa-proj2/pitch_form_noise/spk016/6019-3185-0048_pitch_form_noise.wav,6019-3185-0048,pitch_form_noise,ON THE PART OF MARGARET IT SEEMED AS IF A NEW WORLD HAD DAWNED UPON HER THAT SHE HAD NOT SO MUCH AS SUSPECTED AMONG THE CAPACITIES OF HUMAN EXPERIENCE LIKE SOME BIRD SHE SEEMED WITH POWERS UNEXERCISED FOR SOARING AND FLYING,"and your ears and ears become very universal. Have an open ears tightly, and your ears look closer to the impact. A questo, and a good sound effect.",0.9761904761904762
/Users/gabrieladiaz/Documents/GitHub/p2-gabexa-proj2/pitch_form_noise/spk016/6019-3185-0054_pitch_form_noise.wav,6019-3185-0054,pitch_form_noise,NOT DAZZLING BUT RESPECTABLE AND SO AMIABLE WERE HIS TEMPER AND MANNERS THAT I HAD INTRODUCED HIM EVERYWHERE AND EVERYWHERE HE WAS A FAVORITE AND EVERYWHERE INDEED EXCEPT EXACTLY THERE WHERE ONLY IN THIS WORLD HE CARED FOR FAVOR,"Look at that. It's very warm and pretty velvety. It exists andoo, like usual, but it's good for 나는, we have so many angers.",0.9743589743589743
/Users/gabrieladiaz/Documents/GitHub/p2-gabexa-proj2/pitch_form_noise/spk016/6019-3185-0055_pitch_form_noise.wav,6019-3185-0055,pitch_form_noise,SHE IT WAS WHOM HE LOVED AND HAD LOVED FOR YEARS WITH THE WHOLE ARDOR OF HIS ARDENT SOUL SHE IT WAS FOR WHOM OR AT WHOSE COMMAND HE WOULD WILLINGLY HAVE DIED EARLY HE HAD FELT THAT IN HER HANDS LAY HIS DESTINY,He had a lot of good luck and had more good news. But all of the others had a lot of good news. He had a lot of good news or any kind. It was a really hard time. He had a lot of good news. He had a lot of good news.,1.0681818181818181
/Users/gabrieladiaz/Documents/GitHub/p2-gabexa-proj2/pitch_form_noise/spk016/6019-3185-0060_pitch_form_noise.wav,6019-3185-0060,pitch_form_noise,REVEREND FATHER DO NOT YOU WITH THE PURPOSE OF REMOVING ME FROM TEMPTATION BE YOURSELF THE INSTRUMENT FOR TEMPTING ME INTO A REBELLION AGAINST THE CHURCH DO NOT YOU WEAVE SNARES ABOUT MY STEPS SNARES THERE ARE ALREADY AND BUT TOO MANY,You're a peck. Not you. You're a peck. You're a peck. You're a peck. You're not me. There's not a peck. There's you already.,0.9285714285714286
/Users/gabrieladiaz/Documents/GitHub/p2-gabexa-proj2/pitch_form_noise/spk016/6019-3185-0078_pitch_form_noise.wav,6019-3185-0078,pitch_form_noise,NOW RUSHED TUMULTUOUSLY OUT OF THE BALLROOM TO SATISFY THEMSELVES ON THE SPOT THE DISTANCE WAS NOT GREAT AND WITHIN FIVE MINUTES SEVERAL PERSONS RETURNED HASTILY AND CRIED OUT TO THE CROWD OF LADIES THAT ALL WAS TRUE WHICH THE YOUNG GIRL HAD SAID,"I was told that we had an oil in the pan, and we had an oil in the pot. It didn't work right. And it didn't iron, and it will burn and be turned into a gank. And it will dry out to the ground and oil. And it all will be true if you remember all this time.",1.1363636363636365
/Users/gabrieladiaz/Documents/GitHub/p2-gabexa-proj2/pitch_form_noise/spk016/6019-3185-0083_pitch_form_noise.wav,6019-3185-0083,pitch_form_noise,THAT SIGHT WAS MORE THAN COULD BE BORNE BY ONE WHO STOOD A LITTLE BEHIND THE GROUP HE RUSHED FORWARD WITH EYES GLARING LIKE A TIGER'S AND LEVELED A BLOW AT MAXIMILIAN IT WAS POOR MANIACAL VON HARRELSTEIN,"That's like the more that you are and I want you to be a little behind the wheel. You are forward. I'm very much behind you. And the more you are, actually, the more I will want to help you.",0.9210526315789473
/Users/gabrieladiaz/Documents/GitHub/p2-gabexa-proj2/pitch_form_noise/spk016/6019-3185-0089_pitch_form_noise.wav,6019-3185-0089,pitch_form_noise,GOLD REPEATERS MASSY PLATE GOLD SNUFF BOXES UNTOUCHED THAT ARGUMENT CERTAINLY WEIGHED MUCH IN HIS FAVOR AND YET AGAIN IT WAS TURNED AGAINST HIM FOR A MAGISTRATE ASKED HIM HOW HE HAPPENED TO KNOW ALREADY THAT NOTHING HAD BEEN TOUCHED,"over here, Matthew poet, Goldsmith Johnsowe. I think that beers are certainly way�� driven. And again, this is today. For認為 where you have to find the Pepsi bottles you've had before already, the Matthews and Highlands fell.",0.95
/Users/gabrieladiaz/Documents/GitHub/p2-gabexa-proj2/pitch_form_noise/spk016/6019-3185-0096_pitch_form_noise.wav,6019-3185-0096,pitch_form_noise,FOR THE FOOTSTEPS WERE VERY DIFFERENT IN OUTLINE FROM HIS AND SMALLER FOR AARON WAS A MAN OF COLOSSAL BUILD,"We're peeking fc at, so we're very sniping, we're not on the hill! And 12, we'll get on the hill, and block the hill!",1.1
/Users/gabrieladiaz/Documents/GitHub/p2-gabexa-proj2/pitch_form_noise/spk016/6019-3185-0101_pitch_form_noise.wav,6019-3185-0101,pitch_form_noise,ATTACKED THEM SINGLY IN FLIGHT FOR IN THIS FIRST CASE ALL BUT ONE OF THE MURDERED PERSONS APPEARED TO HAVE BEEN MAKING FOR THE STREET DOOR AND IN ALL THIS THERE WAS NO SUBJECT FOR WONDER EXCEPT THE ORIGINAL ONE AS TO THE MOTIVE,"Exactly what he will find, for any turning, all that you wanted to marry Bennie, i think that he will be moved for 3 blow, man. All that Israel expels between 210 and 3cej men, either by 10� dishwasher.",0.9318181818181818
/Users/gabrieladiaz/Documents/GitHub/p2-gabexa-proj2/pitch_form_noise/spk016/6019-3185-0105_pitch_form_noise.wav,6019-3185-0105,pitch_form_noise,WOULD HAVE BEEN TOO SMALL TO DISTRESS THE MOST TIMID WHILE TO YOUNG AND HIGH SPIRITED PEOPLE WITH COURAGE TO SPARE FOR ORDINARY TRIALS,"but you take people all these threats and look at them. And now in high-spirited people, they carry people and they're over there and fly.",1.0416666666666667
/Users/gabrieladiaz/Documents/GitHub/p2-gabexa-proj2/pitch_form_noise/spk016/6019-3185-0110_pitch_form_noise.wav,6019-3185-0110,pitch_form_noise,TRUE THEY WERE BIGOTED IN A DEGREE WHICH INDICATED FEEBLENESS OF INTELLECT BUT THAT WOUNDED NO MAN IN PARTICULAR WHILE TO MANY IT RECOMMENDED THEM TRUE THEIR CHARITY WAS NARROW AND EXCLUSIVE BUT TO THOSE OF THEIR OWN RELIGIOUS BODY IT EXPANDED MUNIFICENTLY,educated in memoratic results taught re- сделал an second scale,0.9767441860465116
/Users/gabrieladiaz/Documents/GitHub/p2-gabexa-proj2/pitch_form_noise/spk016/6019-3185-0111_pitch_form_noise.wav,6019-3185-0111,pitch_form_noise,AND BEING RICH BEYOND THEIR WANTS OR ANY MEANS OF EMPLOYING WEALTH WHICH THEIR GLOOMY ASCETICISM ALLOWED THEY HAD THE POWER OF DOING A GREAT DEAL OF GOOD AMONG THE INDIGENT PAPISTS OF THE SUBURBS,and the only thing that makes you longer what you in real life or what you think of why his heart becomes larger. and your 크 goes harder.,0.9428571428571428
/Users/gabrieladiaz/Documents/GitHub/p2-gabexa-proj2/pitch_form_noise/spk017/125-121342-0000_pitch_form_noise.wav,125-121342-0000,pitch_form_noise,A FATHOM DEEP IN SLEEP I LIE WITH OLD DESIRES RESTRAINED BEFORE TO CLAMOR LIFEWARD WITH A CRY AS DARK FLIES OUT THE GREYING DOOR AND SO IN QUEST OF CREEDS TO SHARE I SEEK ASSERTIVE DAY AGAIN,The final chance of our life will open the eyes of straight before. To fill the line for your cry as your eyes are growing lower. And so plus your grace to share our seed certainty again.,0.868421052631579
/Users/gabrieladiaz/Documents/GitHub/p2-gabexa-proj2/pitch_form_noise/spk017/125-121342-0001_pitch_form_noise.wav,125-121342-0001,pitch_form_noise,BUT OLD MONOTONY IS THERE ENDLESS AVENUES OF RAIN OH MIGHT I RISE AGAIN MIGHT I THROW OFF THE HEAT OF THAT OLD WINE SEE THE NEW MORNING MASS THE SKY WITH FAIRY TOWERS LINE ON LINE,But their whole collection is there. And this time is ben. Home items went in. Like a hell off of you after that old. Sing a new one in that garage. There are onecraft for that one.,0.8918918918918919
/Users/gabrieladiaz/Documents/GitHub/p2-gabexa-proj2/pitch_form_noise/spk017/125-121342-0006_pitch_form_noise.wav,125-121342-0006,pitch_form_noise,CAME A FURTHER SCATTERING OF PEOPLE WHOSE EYES AS THEY EMERGED GLANCED INVARIABLY FIRST AT THE WET STREET THEN AT THE RAIN FILLED AIR FINALLY AT THE DISMAL SKY LAST A DENSE STROLLING MASS,"Inハce�로, you are describes a famous manShould be entering the facility that is called the universe. I live genesis of an experienced child.",0.9411764705882353
/Users/gabrieladiaz/Documents/GitHub/p2-gabexa-proj2/pitch_form_noise/spk017/125-121342-0007_pitch_form_noise.wav,125-121342-0007,pitch_form_noise,THAT DEPRESSED HIM WITH ITS HEAVY ODOR COMPOUNDED OF THE TOBACCO SMELL OF THE MEN AND THE FETID SENSUOUSNESS OF STALE POWDER ON WOMEN AFTER THE THICK CROWD CAME ANOTHER SCATTERING A STRAY HALF DOZEN A MAN ON CRUTCHES,"This must seem that it's heavy-oiled. And pound it, and attack it so that it's heavy-oiled. And it's essential to stop the family. After a big crowd came out of town, a straight-out of a mental purchase.",0.8974358974358975
/Users/gabrieladiaz/Documents/GitHub/p2-gabexa-proj2/pitch_form_noise/spk017/125-121342-0012_pitch_form_noise.wav,125-121342-0012,pitch_form_noise,AT BEST JUST PEOPLE TOO HOT OR TOO COLD TIRED WORRIED HE PICTURED THE ROOMS WHERE THESE PEOPLE LIVED WHERE THE PATTERNS OF THE BLISTERED WALL PAPERS WERE HEAVY REITERATED SUNFLOWERS ON GREEN AND YELLOW BACKGROUNDS,"that's your feeling to be a new flower, a new goal to achieve life. You recognise the installation, is it like进 meet, but parents'll push you off you. because there will definitely be way to suffer as long as anything has an endless Baghdad for me.",1.25
/Users/gabrieladiaz/Documents/GitHub/p2-gabexa-proj2/pitch_form_noise/spk017/125-121342-0014_pitch_form_noise.wav,125-121342-0014,pitch_form_noise,LEAVING HARD BROWN DEPOSITS IN THE BOWL IT WAS NOT SO BAD WHERE THERE WERE ONLY MEN OR ELSE ONLY WOMEN IT WAS WHEN THEY WERE VILELY HERDED THAT IT ALL SEEMED SO ROTTEN IT WAS SOME SHAME THAT WOMEN GAVE OFF AT HAVING MEN SEE THEM TIRED AND POOR,He didn't heart Protoku. He was also thatР I mean what I saw did mean it was only one night and Kug succession also survived this was omg I really love the 77th time I feel,0.92
/Users/gabrieladiaz/Documents/GitHub/p2-gabexa-proj2/pitch_form_noise/spk017/125-121342-0016_pitch_form_noise.wav,125-121342-0016,pitch_form_noise,AND DANGER IT WAS AN ATMOSPHERE WHEREIN BIRTH AND MARRIAGE AND DEATH WERE LOATHSOME SECRET THINGS HE REMEMBERED ONE DAY IN THE SUBWAY WHEN A DELIVERY BOY HAD BROUGHT IN A GREAT FUNERAL WREATH OF FRESH FLOWERS,"and leave her. That you wouldn't have to see it when I wrote in the management's at the moment, so we see her things. You remember all the names that were in the story? All I had wrote in the break, you know all the names of fresh flowers.",1.162162162162162
/Users/gabrieladiaz/Documents/GitHub/p2-gabexa-proj2/pitch_form_noise/spk017/125-121342-0018_pitch_form_noise.wav,125-121342-0018,pitch_form_noise,AND SAYING SOMETHING TO HIS COMPANION WITH A LOOK OF UTTER DISGUST PROBABLY THOUGHT AMORY WHAT HE SAID WAS MY GOD AREN'T PEOPLE HORRIBLE NEVER BEFORE IN HIS LIFE HAD AMORY CONSIDERED POOR PEOPLE,"And saying something, which we didn'tian would've called God's site. Okay, that might be the matter. Number of words keeps on. Never الف트 & fathom remedies there.",0.9117647058823529
